{
  "uecfVersion": "1.0",
  "component": "example-widget",
  "version": "0.1.0",
  "spdxExpression": "LicenseRef-UECF-Headquarter-1.0 AND Apache-2.0",
  "implementationLicense": "Apache-2.0",
  "sourceUrl": "https://github.com/EU-UNION-AI-PACT/uecf-poc",
  "declarations": {
    "prohibitedUse": false,
    "nonDiscrimination": true,
    "dsaNoticeAndAction": "https://example.org/uecf/notice-and-action"
  },
  "bridge": {
    "registry": "0x0000000000000000000000000000000000000000",
    "txHash": "0x0000000000000000000000000000000000000000000000000000000000000000"
  }
}
