{
  "uecfVersion": "1.0",
  "component": "dataset-wikidata",
  "version": "1.0.0",
  "spdxExpression": "LicenseRef-UECF-Headquarter-1.0 AND CC0-1.0",
  "implementationLicense": "CC0-1.0",
  "sourceUrl": "https://www.wikidata.org/",
  "declarations": {
    "prohibitedUse": false,
    "nonDiscrimination": true,
    "dsaNoticeAndAction": "https://www.wikidata.org/wiki/Wikidata:Contact_the_development_team"
  }
}
